Fast Arithmetic Hardware Library For RLWE-Based Homomorphic Encryption,https://arxiv.org/pdf/2007.01648
"A Closer Look at Local Aggregation Operators in Point <span class=""search-hit mathjax"">Cloud</span> Analysis",https://arxiv.org/pdf/2007.01294
Five-Layers SDP-Based Hierarchical Security Paradigm for Multi-access Edge Computing,https://arxiv.org/pdf/2007.01246
Democratizing the Edge: A Pervasive Edge Computing Framework,https://arxiv.org/pdf/2007.00641
LeakyPick: IoT Audio Spy Detector,https://arxiv.org/pdf/2007.00500
The Meshing of the Sky: Delivering Ubiquitous Connectivity to Ground Internet of Things,https://arxiv.org/pdf/2007.00104
Towards Robust LiDAR-based Perception in Autonomous Driving: General Black-box Adversarial Sensor Attack and Countermeasures,https://arxiv.org/pdf/2006.16974
QoE Based Revenue Maximizing Dynamic Resource Allocation and Pricing for Fog-Enabled Mission-Critical IoT Applications,https://arxiv.org/pdf/2006.16894
Applying Machine Learning Techniques for Caching in Edge Networks: A Comprehensive Survey,https://arxiv.org/pdf/2006.16864
"An energy efficient service composition mechanism using a hybrid meta-heuristic algorithm in a mobile <span class=""search-hit mathjax"">cloud</span> environment",https://arxiv.org/pdf/2006.16771
"ARPEGE <span class=""search-hit mathjax"">Cloud</span> Cover Forecast Post-Processing with Convolutional Neural Network",https://arxiv.org/pdf/2006.16678
A systematic study of \ce{CO2} planetary atmospheres and their link to the stellar environment,https://arxiv.org/pdf/2006.16650
"FDA3 : Federated Defense Against Adversarial Attacks for <span class=""search-hit mathjax"">Cloud</span>-Based IIoT Applications",https://arxiv.org/pdf/2006.15632
An Interactive Data Visualization and Analytics Tool to Evaluate Mobility and Sociability Trends During COVID-19,https://arxiv.org/pdf/2006.14882
Duodepth: Static Gesture Recognition Via Dual Depth Sensors,https://arxiv.org/pdf/2006.14691
"Energy Efficient Processing Allocation in Opportunistic <span class=""search-hit mathjax"">Cloud</span>-Fog-Vehicular Edge <span class=""search-hit mathjax"">Cloud</span> <span class=""search-hit mathjax"">Architectures</span>",https://arxiv.org/pdf/2006.14659
An empirical study of availability and reliability properties of the Bitcoin Lightning Network,https://arxiv.org/pdf/2006.14358
"An Agent-based <span class=""search-hit mathjax"">Cloud</span> Service Negotiation in Hybrid <span class=""search-hit mathjax"">Cloud</span> Computing",https://arxiv.org/pdf/2006.13109
Optimal Network Slicing for Service-Oriented Networks with Flexible Routing and Guaranteed E2E Latency,https://arxiv.org/pdf/2006.13019
"Performance Evaluation of Fuzzy Integrated Firewall Model for Hybrid <span class=""search-hit mathjax"">Cloud</span> based on Packet Utilization",https://arxiv.org/pdf/2006.12736
Optimizing Downlink Resource Allocation in Multiuser MIMO Networks via Fractional Programming and the Hungarian Algorithm,https://arxiv.org/pdf/2006.12549
UV-Net: Learning from Boundary Representations,https://arxiv.org/pdf/2006.10211
Wide-Area Data Analytics,https://arxiv.org/pdf/2006.10188
A block coordinate descent optimizer for classification problems exploiting convexity,https://arxiv.org/pdf/2006.10123
Collaborative Pipeline Using Opportunistic Mobile Resources via D2D for Computation-Intensive Tasks,https://arxiv.org/pdf/2006.09301
Distributed File System for an Edge-Based Environment,https://arxiv.org/pdf/2006.09182
"Optimal Virtual Network Function Deployment for 5G Network Slicing in a Hybrid <span class=""search-hit mathjax"">Cloud</span> Infrastructure",https://arxiv.org/pdf/2006.08774
Triggerflow: Trigger-based Orchestration of Serverless Workflows,https://arxiv.org/pdf/2006.08654
"Renewable Energy Assisted Function Splitting in <span class=""search-hit mathjax"">Cloud</span> Radio Access Networks",https://arxiv.org/pdf/2006.08258
Load-balanced Service Function Chaining in Edge Computing over FiWi Access Networks for Internet of Things,https://arxiv.org/pdf/2006.08134
"<span class=""search-hit mathjax"">Architecture</span> Support for FPGA Multi-tenancy in the <span class=""search-hit mathjax"">Cloud</span>",https://arxiv.org/pdf/2006.08026
"<span class=""search-hit mathjax"">Cloud</span> as an Attack Platform",https://arxiv.org/pdf/2006.07914
"Launching Stealth Attacks using <span class=""search-hit mathjax"">Cloud</span>",https://arxiv.org/pdf/2006.07908
PLVER: Joint Stable Allocation and Content Replication for Edge-assisted Live Video Delivery,https://arxiv.org/pdf/2006.07505
"Local-Area-Learning Network: Meaningful Local Areas for Efficient Point <span class=""search-hit mathjax"">Cloud</span> Analysis",https://arxiv.org/pdf/2006.07226
Federated and continual learning for classification tasks in a society of devices,https://arxiv.org/pdf/2006.07129
Sovereign: User-Controlled Smart Homes,https://arxiv.org/pdf/2006.06131
MVLidarNet: Real-Time Multi-Class Scene Understanding for Autonomous Driving Using Multiple Views,https://arxiv.org/pdf/2006.05518
Probabilistic Semantic Mapping for Urban Autonomous Driving Applications,https://arxiv.org/pdf/2006.04894
Optimal Transport Graph Neural Networks,https://arxiv.org/pdf/2006.04804
Lorentz Group Equivariant Neural Network for Particle Physics,https://arxiv.org/pdf/2006.04780
"Serverless on FHIR: Deploying machine learning models for healthcare on the <span class=""search-hit mathjax"">cloud</span>",https://arxiv.org/pdf/2006.04748
"Softwarization, Virtualization, &amp; Machine Learning For Intelligent &amp; Effective V2X Communications",https://arxiv.org/pdf/2006.04595
Quantum computation of silicon electronic band structure,https://arxiv.org/pdf/2006.03807
"Skedulix: Hybrid <span class=""search-hit mathjax"">Cloud</span> Scheduling for Cost-Efficient Execution of Serverless Applications",https://arxiv.org/pdf/2006.03720
"Blockchain, Fog and IoT Integrated Framework: Review, <span class=""search-hit mathjax"">Architecture</span> and Evaluation",https://arxiv.org/pdf/2006.03596
From Federated to Fog Learning: Distributed Machine Learning over Heterogeneous Wireless Networks,https://arxiv.org/pdf/2006.03594
FaaSdom: A Benchmark Suite for Serverless Computing,https://arxiv.org/pdf/2006.03271
milliEgo: Single-chip mmWave Radar Aided Egomotion Estimation via Deep Sensor Fusion,https://arxiv.org/pdf/2006.02266
"Securing Your Collaborative Jupyter Notebooks in the <span class=""search-hit mathjax"">Cloud</span> using Container and Load Balancing Services",https://arxiv.org/pdf/2006.01818
"SiEVE: Semantically Encoded Video Analytics on Edge and <span class=""search-hit mathjax"">Cloud</span>",https://arxiv.org/pdf/2006.01318
RUHSNet: 3D Object Detection Using Lidar Data in Real Time,
Exceeding Conservative Limits: A Consolidated Analysis on Modern Hardware Margins,https://arxiv.org/pdf/2006.01049
Understanding Uncertainty of Edge Computing: New Principle and Design Approach,https://arxiv.org/pdf/2006.01032
"Algorithms for Computing in Fog Systems: principles, algorithms, and Challenges",https://arxiv.org/pdf/2006.00876
"Multi-scale <span class=""search-hit mathjax"">Cloud</span> Detection in Remote Sensing Images using a Dual Convolutional Neural Network",https://arxiv.org/pdf/2006.00836
Cheetah: Optimizing and Accelerating Homomorphic Encryption for Private Inference,https://arxiv.org/pdf/2006.00505
"Classical and Quantum Data Interaction in Programming Languages: A Runtime <span class=""search-hit mathjax"">Architecture</span>",https://arxiv.org/pdf/2006.00131
"A <span class=""search-hit mathjax"">Cloud</span> Native Platform for Stateful Streaming",https://arxiv.org/pdf/2006.00064
Stereo Vision Based Single-Shot 6D Object Pose Estimation for Bin-Picking by a Robot Manipulator,https://arxiv.org/pdf/2005.13759
"Road Segmentation on low resolution Lidar point <span class=""search-hit mathjax"">clouds</span> for autonomous vehicles",https://arxiv.org/pdf/2005.13102
"Exploiting Local and <span class=""search-hit mathjax"">Cloud</span> Sensor Fusion in Intermittently Connected Sensor Networks",https://arxiv.org/pdf/2005.12495
An Analysis of Fog Computing Data Placement Algorithms,https://arxiv.org/pdf/2005.11847
Vehicular Fog Computing Enabled Real-time Collision Warning via Trajectory Calibration,https://arxiv.org/pdf/2005.11508
Machine Learning in the Internet of Things for Industry 4.0,https://arxiv.org/pdf/2005.11146
Modeling and Optimization of Latency in Erasure-coded Storage Systems,https://arxiv.org/pdf/2005.10855
"Application Management in Fog Computing Environments: A Taxonomy, Review and Future Directions",https://arxiv.org/pdf/2005.10460
Compute-Bound and Low-Bandwidth Distributed 3D Graph-SLAM,https://arxiv.org/pdf/2005.10222
"Exploring Recurrent, Memory and Attention Based <span class=""search-hit mathjax"">Architectures</span> for Scoring Interactional Aspects of Human-Machine Text Dialog",https://arxiv.org/pdf/2005.09834
"Deep Learning for LiDAR Point <span class=""search-hit mathjax"">Clouds</span> in Autonomous Driving: A Review",https://arxiv.org/pdf/2005.09830
PubSub implementation in Haskell with formal verification in Coq,https://arxiv.org/pdf/2005.09452
"GROVE: A Cost-Efficient Green Radio over Ethernet <span class=""search-hit mathjax"">Architecture</span> for Next Generation Radio Access Network",https://arxiv.org/pdf/2005.09081
Attack-aware Security Function Chain Reordering,https://arxiv.org/pdf/2005.08364
Lost and Found: Stopping Bluetooth Finders from Leaking Private Information,https://arxiv.org/pdf/2005.08208
Mobile Edge Computing Network Control: Tradeoff Between Delay and Cost,https://arxiv.org/pdf/2005.07854
Joint Planning of Network Slicing and Mobile Edge Computing: Models and Algorithms,https://arxiv.org/pdf/2005.07301
"A Secure Fog Based <span class=""search-hit mathjax"">Architecture</span> for Industrial Internet of Things and Industry 4.0",https://arxiv.org/pdf/2005.07147
"Enabling Edge <span class=""search-hit mathjax"">Cloud</span> Intelligence for Activity Learning in Smart Home",https://arxiv.org/pdf/2005.06885
Exploiting Multi-Layer Grid Maps for Surround-View Semantic Segmentation of Sparse LiDAR Data,https://arxiv.org/pdf/2005.06667
"A Large-Scale, Open-Domain, Mixed-Interface Dialogue-Based ITS for STEM",https://arxiv.org/pdf/2005.06616
"Centaur: A Chiplet-based, Hybrid Sparse-Dense Accelerator for Personalized Recommendations",https://arxiv.org/pdf/2005.05968
"Fogbanks: Future Dynamic Vehicular Fog Banks for Processing, Sensing and Storage in 6G",https://arxiv.org/pdf/2005.04731
"An Attestation <span class=""search-hit mathjax"">Architecture</span> for Blockchain Networks",https://arxiv.org/pdf/2005.04293
Caching Video-on-Demand in Metro and Access Fog Data Centres,https://arxiv.org/pdf/2005.02720
Reliable and Efficient Long-Term Social Media Monitoring,https://arxiv.org/pdf/2005.02442
"Evaluation of Applications Latency in Server Centric Passive Optical Network Based Data Centre <span class=""search-hit mathjax"">Architectures</span>",https://arxiv.org/pdf/2005.02440
"Peak Power Shaving for Reduced Electricity Costs in <span class=""search-hit mathjax"">Cloud</span> Data Centers: Opportunities and Challenges",https://arxiv.org/pdf/2005.02428
One-step regression and classification with crosspoint resistive memory arrays,https://arxiv.org/pdf/2005.01988
Industrial Control via Application Containers:Maintaining determinism in IAAS,https://arxiv.org/pdf/2005.01890
"Streaming Object Detection for 3-D Point <span class=""search-hit mathjax"">Clouds</span>",https://arxiv.org/pdf/2005.01864
Evacuação de Dados em Nuvens Ópticas com base no SLA sob Cenário de Desastre,https://arxiv.org/pdf/2005.01461
"Interactive distributed <span class=""search-hit mathjax"">cloud</span>-based web-server systems for the smart healthcare industry",https://arxiv.org/pdf/2005.01442
"Monte Carlo modeling photon-tissue interaction using on-demand <span class=""search-hit mathjax"">cloud</span> infrastructure",https://arxiv.org/pdf/2005.01108
Towards Deep Learning Methods for Quality Assessment of Computer-Generated Imagery,https://arxiv.org/pdf/2005.00836
On the Design of Co-operating Blockchains for IoT,https://arxiv.org/pdf/2005.00658
"Leveraging Context-awareness to Better Support the IoT <span class=""search-hit mathjax"">Cloud</span>-Edge Continuum",https://arxiv.org/pdf/2005.00121
"A Survey on Time-Sensitive Resource Allocation in the <span class=""search-hit mathjax"">Cloud</span> Continuum",https://arxiv.org/pdf/2004.14559
Caramel: Accelerating Decentralized Distributed Deep Learning with Computation Scheduling,https://arxiv.org/pdf/2004.14020
"<span class=""search-hit mathjax"">Cloud</span> Network Slicing: A systematic mapping study from scientific publications",https://arxiv.org/pdf/2004.13675
"Energy Efficient Software Matching in Distributed Vehicular Fog Based <span class=""search-hit mathjax"">Architecture</span> with <span class=""search-hit mathjax"">Cloud</span> and Fixed Fog Nodes",https://arxiv.org/pdf/2004.12747
"Computing server power modeling in a data center: survey,taxonomy and performance evaluation",https://arxiv.org/pdf/2004.12335
Privacy in Deep Learning: A Survey,https://arxiv.org/pdf/2004.12254
"SAIA: Split Artificial Intelligence <span class=""search-hit mathjax"">Architecture</span> for Mobile Healthcare System",https://arxiv.org/pdf/2004.12059
Towards A Domain-Customized Automated Machine Learning Framework For Networks and Systems,https://arxiv.org/pdf/2004.11931
"A Mobile <span class=""search-hit mathjax"">Cloud</span>-Based eHealth Scheme",https://arxiv.org/pdf/2004.11842
"Scan-based Semantic Segmentation of LiDAR Point <span class=""search-hit mathjax"">Clouds</span>: An Experimental Study",https://arxiv.org/pdf/2004.11803
"6G White paper: Research challenges for Trust, Security and Privacy",https://arxiv.org/pdf/2004.11665
"Any Motion Detector: Learning Class-agnostic Scene Dynamics from a Sequence of LiDAR Point <span class=""search-hit mathjax"">Clouds</span>",https://arxiv.org/pdf/2004.11647
"<span class=""search-hit mathjax"">Cloud</span> Deployment Tradeoffs for the Analysis of Spatially-Distributed Systems of Internet-of-Things",https://arxiv.org/pdf/2004.11428
Hybrid Blockchain-Enabled Secure Microservices Fabric for Decentralized Multi-Domain Avionics Systems,https://arxiv.org/pdf/2004.10674
A Fortran-Keras Deep Learning Bridge for Scientific Computing,https://arxiv.org/pdf/2004.10652
"EMAP: A <span class=""search-hit mathjax"">Cloud</span>-Edge Hybrid Framework for EEG Monitoring and Cross-Correlation Based Real-time Anomaly Prediction",https://arxiv.org/pdf/2004.10491
"Modeling Network <span class=""search-hit mathjax"">Architecture</span>: A <span class=""search-hit mathjax"">Cloud</span> Case Study",https://arxiv.org/pdf/2004.10350
"CAPODAZ: A Containerised Authorisation and Policy-driven <span class=""search-hit mathjax"">Architecture</span> using Microservices",https://arxiv.org/pdf/2004.10276
The Imandra Automated Reasoning System (system description),https://arxiv.org/pdf/2004.10263
Fog-Based Detection for Random-Access IoT Networks with Per-Measurement Preambles,https://arxiv.org/pdf/2004.10084
Distributed Resources for the Earth System Grid Advanced Management (DREAM),https://arxiv.org/pdf/2004.09599
"Shape-Oriented Convolution Neural Network for Point <span class=""search-hit mathjax"">Cloud</span> Analysis",https://arxiv.org/pdf/2004.09411
"Airborne LiDAR Point <span class=""search-hit mathjax"">Cloud</span> Classification with Graph Attention Convolution Neural Network",https://arxiv.org/pdf/2004.09057
Heterogeneous CPU+GPU Stochastic Gradient Descent Algorithms,https://arxiv.org/pdf/2004.08771
"Novel algorithms and high-performance <span class=""search-hit mathjax"">cloud</span> computing enable efficient fully quantum mechanical protein-ligand scoring",https://arxiv.org/pdf/2004.08725
A Data-Driven Frequency Scaling Approach for Deadline-aware Energy Efficient Scheduling on Graphics Processing Units (GPUs),https://arxiv.org/pdf/2004.08177
"Feature Selection and Intrusion Detection in <span class=""search-hit mathjax"">Cloud</span> Environment based on Machine Learning Algorithms",https://arxiv.org/pdf/2004.07943
"Energy Efficient and Delay Aware Vehicular Edge <span class=""search-hit mathjax"">Cloud</span>",https://arxiv.org/pdf/2004.07170
"Distributed Data Verification Protocols in <span class=""search-hit mathjax"">Cloud</span> Computing",https://arxiv.org/pdf/2004.07079
"An efficient deception <span class=""search-hit mathjax"">architecture</span> for <span class=""search-hit mathjax"">cloud</span>-based virtual networks",https://arxiv.org/pdf/2004.06933
Contextual-Bandit Anomaly Detection for IoT Data in Distributed Hierarchical Edge Computing,https://arxiv.org/pdf/2004.06896
"Issues and challenges in <span class=""search-hit mathjax"">Cloud</span> Storage <span class=""search-hit mathjax"">Architecture</span>: A Survey",https://arxiv.org/pdf/2004.06809
Peer Offloading in Mobile Edge Computing with Worst-Case Response Time Guarantees,https://arxiv.org/pdf/2004.06453
Topology of deep neural networks,https://arxiv.org/pdf/2004.06093
"Multi-stage Jamming Attacks Detection using Deep Learning Combined with Kernelized Support Vector Machine in 5G <span class=""search-hit mathjax"">Cloud</span> Radio Access Networks",https://arxiv.org/pdf/2004.06077
Software-Defined Network for End-to-end Networked Science at the Exascale,https://arxiv.org/pdf/2004.05953
QoS-Driven Job Scheduling: Multi-Tier Dependency Considerations,https://arxiv.org/pdf/2004.05695
PrivEdge: From Local to Distributed Private Training and Prediction,https://arxiv.org/pdf/2004.05574
"Optimized Distributed Processing in a Vehicular <span class=""search-hit mathjax"">Cloud</span> <span class=""search-hit mathjax"">Architecture</span>",https://arxiv.org/pdf/2004.05396
Formal Modelling and Verification of Software Defined Network,https://arxiv.org/pdf/2004.04425
Knowledge Distillation for Mobile Edge Computation Offloading,https://arxiv.org/pdf/2004.04366
Deep Manifold Prior,https://arxiv.org/pdf/2004.04242
Learning 3D Semantic Scene Graphs from 3D Indoor Reconstructions,https://arxiv.org/pdf/2004.03967
HybridDNN: A Framework for High-Performance Hybrid DNN Accelerator Design and Implementation,https://arxiv.org/pdf/2004.03804
Modularis: Modular Relational Analytics over Heterogeneous Distributed Platforms,https://arxiv.org/pdf/2004.03488
"MNEW: Multi-domain Neighborhood Embedding and Weighting for Sparse Point <span class=""search-hit mathjax"">Clouds</span> Segmentation",https://arxiv.org/pdf/2004.03401
"5G Radio Access Network <span class=""search-hit mathjax"">Architecture</span> for Terrestrial Broadcast Services",https://arxiv.org/pdf/2004.03261
COVID-MobileXpert: On-Device COVID-19 Patient Triage and Follow-up using Chest X-rays,https://arxiv.org/pdf/2004.03042
An Experimental Study on Microservices based Edge Computing Platforms,https://arxiv.org/pdf/2004.02372
PointGroup: Dual-Set Point Grouping for 3D Instance Segmentation,https://arxiv.org/pdf/2004.01658
Towards Better Generalization: Joint Depth-Pose Learning without PoseNet,https://arxiv.org/pdf/2004.01314
AI4COVID-19: AI Enabled Preliminary Diagnosis for COVID-19 from Cough Samples via an App,https://arxiv.org/pdf/2004.01275
Improving 3D Object Detection through Progressive Population Based Augmentation,https://arxiv.org/pdf/2004.00831
Cost-efficient and Skew-aware Data Scheduling for Incremental Learning in 5G Network,https://arxiv.org/pdf/2004.00799
The effect of high nitrogen pressures on the habitable zone and an appraisal of greenhouse states,https://arxiv.org/pdf/2004.00229
MetaPoison: Practical General-purpose Clean-label Data Poisoning,https://arxiv.org/pdf/2004.00225
"On Coordination of Smart Grid and Cooperative <span class=""search-hit mathjax"">Cloud</span> Providers",https://arxiv.org/pdf/2003.13675
"A Privacy-Preserving Distributed <span class=""search-hit mathjax"">Architecture</span> for Deep-Learning-as-a-Service",https://arxiv.org/pdf/2003.13541
OneShot Global Localization: Instant LiDAR-Visual Pose Estimation,https://arxiv.org/pdf/2003.13279
The CARMENES search for exoplanets around M dwarfs. A super-Earth planet orbiting HD 79211 (GJ 338 B),https://arxiv.org/pdf/2003.13052
IoT Blockchain Solution for Air Quality Monitoring in SmartCities,https://arxiv.org/pdf/2003.12920
"A Truthful Auction for Graph Job Allocation in Vehicular <span class=""search-hit mathjax"">Cloud</span>-assisted Networks",https://arxiv.org/pdf/2003.12631
"A Security and Performance Driven <span class=""search-hit mathjax"">Architecture</span> for <span class=""search-hit mathjax"">Cloud</span> Data Centers",https://arxiv.org/pdf/2003.12598
"Enabling Efficient and Flexible FPGA Virtualization for Deep Learning in the <span class=""search-hit mathjax"">Cloud</span>",https://arxiv.org/pdf/2003.12101
Safety-Aware Hardening of 3D Object Detection Neural Network Systems,https://arxiv.org/pdf/2003.11242
The data center of tomorrow is made up of heterogeneous accelerators,https://arxiv.org/pdf/2003.10950
"Towards Fine-Grained Billing For <span class=""search-hit mathjax"">Cloud</span> Networking",https://arxiv.org/pdf/2003.10745
The Internet of Things as a Deep Neural Network,https://arxiv.org/pdf/2003.10538
"FTT-NAS: Discovering Fault-Tolerant Convolutional Neural <span class=""search-hit mathjax"">Architecture</span>",https://arxiv.org/pdf/2003.10375
"HierTrain: Fast Hierarchical Edge AI Learning with Hybrid Parallelism in Mobile-Edge-<span class=""search-hit mathjax"">Cloud</span> Computing",https://arxiv.org/pdf/2003.09876
New Security Challenges on Machine Learning Inference Engine: Chip Cloning and Model Reverse Engineering,https://arxiv.org/pdf/2003.09739
Grant-Free Coexistence of Critical and Non-Critical IoT Services in Two-Hop Satellite and Terrestrial Networks,https://arxiv.org/pdf/2003.09257
PLOP: Probabilistic poLynomial Objects trajectory Planning for autonomous driving,https://arxiv.org/pdf/2003.08744
"PT2PC: Learning to Generate 3D Point <span class=""search-hit mathjax"">Cloud</span> Shapes from Part Tree Conditions",https://arxiv.org/pdf/2003.08624
A cold atom temporally multiplexed quantum memory with cavity-enhanced noise suppression,https://arxiv.org/pdf/2003.08418
Blockchain-Based Distributed Patient-Centric Image Management System,https://arxiv.org/pdf/2003.08054
"A Dynamic Reduction Network for Point <span class=""search-hit mathjax"">Clouds</span>",https://arxiv.org/pdf/2003.08013
"A Rotation-Invariant Framework for Deep Point <span class=""search-hit mathjax"">Cloud</span> Analysis",https://arxiv.org/pdf/2003.07238
Learning-Based Human Segmentation and Velocity Estimation Using Automatic Labeled LiDAR Sequence for Training,https://arxiv.org/pdf/2003.05093
"<span class=""search-hit mathjax"">Architectural</span> Software Patterns for the Development of IoT Smart Applications",https://arxiv.org/pdf/2003.04781
Convolutional Occupancy Networks,https://arxiv.org/pdf/2003.04618
"Are We Susceptible to Rowhammer? An End-to-End Methodology for <span class=""search-hit mathjax"">Cloud</span> Providers",https://arxiv.org/pdf/2003.04498
"SalsaNext: Fast, Uncertainty-aware Semantic Segmentation of LiDAR Point <span class=""search-hit mathjax"">Clouds</span> for Autonomous Driving",https://arxiv.org/pdf/2003.03653
Trends and Advancements in Deep Neural Network Communication,https://arxiv.org/pdf/2003.03320
"Workload Scheduling on heterogeneous Mobile Edge <span class=""search-hit mathjax"">Cloud</span> in 5G networks to Minimize SLA Violation",https://arxiv.org/pdf/2003.02820
"PointLoc: Deep Pose Regressor for LiDAR Point <span class=""search-hit mathjax"">Cloud</span> Localization",https://arxiv.org/pdf/2003.02392
mmFall: Fall Detection using 4D MmWave Radar and a Hybrid Variational RNN AutoEncoder,https://arxiv.org/pdf/2003.02386
LSQ: Load Balancing in Large-Scale Heterogeneous Systems with Multiple Dispatchers,https://arxiv.org/pdf/2003.02368
IsoRAN: Isolation and Scaling for 5G RANvia User-Level Data Plane Virtualization,https://arxiv.org/pdf/2003.01841
FlexServe: Deployment of PyTorch Models as Flexible REST Endpoints,https://arxiv.org/pdf/2003.01538
"Performance Optimization for Edge-<span class=""search-hit mathjax"">Cloud</span> Serverless Platforms via Dynamic Task Placement",https://arxiv.org/pdf/2003.01310
3D Object Detection From LiDAR Data Using Distance Dependent Feature Extraction,https://arxiv.org/pdf/2003.00888
Resource-Aware Network Topology Management Framework,https://arxiv.org/pdf/2003.00860
"Hypernetwork approach to generating point <span class=""search-hit mathjax"">clouds</span>",https://arxiv.org/pdf/2003.00802
"Resource Management Techniques for <span class=""search-hit mathjax"">Cloud</span>-Based IoT Environment",https://arxiv.org/pdf/2002.12729
Mandate-driven Networking Eco-system: A Paradigm Shift in End-to-End Communications,
Deep Learning for Ultra-Reliable and Low-Latency Communications in 6G Networks,https://arxiv.org/pdf/2002.11045
Fault Diagnosis in Microelectronics Attachment via Deep Learning Analysis of 3D Laser Scans,https://arxiv.org/pdf/2002.10974
FPConv: Learning Local Flattening for Point Convolution,https://arxiv.org/pdf/2002.10701
"Personalized Federated Learning for Intelligent IoT Applications: A <span class=""search-hit mathjax"">Cloud</span>-Edge based Framework",https://arxiv.org/pdf/2002.10671
A Multi-view CNN-based Acoustic Classification System for Automatic Animal Species Identification,https://arxiv.org/pdf/2002.09821
"Taurus: A Data Plane <span class=""search-hit mathjax"">Architecture</span> for Per-Packet ML",https://arxiv.org/pdf/2002.08987
"Alibaba <span class=""search-hit mathjax"">Cloud</span> Quantum Development Platform: Surface Code Simulations with Crosstalk",https://arxiv.org/pdf/2002.08918
