Can We Solve 3D Vision Tasks Starting from A 2D Vision Transformer?,https://arxiv.org/pdf/2209.07026
"SQL and NoSQL Databases Software <span class=""search-hit mathjax"">architectures</span> performance analysis and assessments -- A Systematic Literature review",https://arxiv.org/pdf/2209.06977
"SeRP: Self-Supervised Representation Learning Using Perturbed Point <span class=""search-hit mathjax"">Clouds</span>",https://arxiv.org/pdf/2209.06067
LAMSkyCam: A Low-cost and Miniature Ground-based Sky Camera,https://arxiv.org/pdf/2209.06051
"SVNet: Where SO(3) Equivariance Meets Binarization on Point <span class=""search-hit mathjax"">Cloud</span> Representation",https://arxiv.org/pdf/2209.05924
A Survey on Mobile Edge Computing for Video Streaming: Opportunities and Challenges,https://arxiv.org/pdf/2209.05761
The Switch from Conventional to SDN: The Case for Transport-Agnostic Congestion Control,https://arxiv.org/pdf/2209.04729
Air Computing: A Survey on a New Generation Computation Paradigm in 6G Wireless Networks,https://arxiv.org/pdf/2209.04640
"GRASP-Net: Geometric Residual Analysis and Synthesis for Point <span class=""search-hit mathjax"">Cloud</span> Compression",https://arxiv.org/pdf/2209.04401
Prediction method of Soundscape Impressions using Environmental Sounds and Aerial Photographs,https://arxiv.org/pdf/2209.04077
In-Network Computing With Function as a Service at the Edge,https://arxiv.org/pdf/2209.02983
Graph-PHPA: Graph-based Proactive Horizontal Pod Autoscaling for Microservices using LSTM-GNN,https://arxiv.org/pdf/2209.02551
Power Allocation for Joint Communication and Sensing in Cell-Free Massive MIMO,https://arxiv.org/pdf/2209.01864
"SPCNet: Stepwise Point <span class=""search-hit mathjax"">Cloud</span> Completion Network",https://arxiv.org/pdf/2209.01746
SEFormer: Structure Embedding Transformer for 3D Object Detection,https://arxiv.org/pdf/2209.01745
Deep Live Video Ad Placement on the 5G Edge,https://arxiv.org/pdf/2209.01421
Accelerating Polynomial Multiplication for Homomorphic Encryption on GPUs,https://arxiv.org/pdf/2209.01290
Real-time 3D Single Object Tracking with Transformer,https://arxiv.org/pdf/2209.00860
"PCDNF: Revisiting Learning-based Point <span class=""search-hit mathjax"">Cloud</span> Denoising via Joint Normal Filtering",https://arxiv.org/pdf/2209.00798
DecVi: Adaptive Video Conferencing on Open Peer-to-Peer Networks,https://arxiv.org/pdf/2209.00695
SecDDR: Enabling Low-Cost Secure Memories by Protecting the DDR Interface,https://arxiv.org/pdf/2209.00685
An Anonymous Overlay Routing Protocol for Uplink-Intensive Applications,https://arxiv.org/pdf/2208.14920
A Fresh Look at ECN Traversal in the Wild,https://arxiv.org/pdf/2208.14523
"A Comparative Study On Three Selective <span class=""search-hit mathjax"">Cloud</span> Providers",https://arxiv.org/pdf/2208.14482
"One Year of DDoS Attacks Against a <span class=""search-hit mathjax"">Cloud</span> Provider: an Overview",https://arxiv.org/pdf/2208.14205
Effective Multi-User Delay-Constrained Scheduling with Deep Recurrent Reinforcement Learning,https://arxiv.org/pdf/2208.14074
Detection and Classification of Brain tumors Using Deep Convolutional Neural Networks,https://arxiv.org/pdf/2208.13264
Sub-mW Neuromorphic SNN audio processing applications with Rockpool and Xylo,
A Joint Framework to Privacy-Preserving Edge Intelligence in Vehicular Networks,https://arxiv.org/pdf/2208.12755
Universal Mini-Batch Consistency for Set Encoding Functions,https://arxiv.org/pdf/2208.12401
"<span class=""search-hit mathjax"">Cloud</span> Process Execution Engine: <span class=""search-hit mathjax"">Architecture</span> and Interfaces",https://arxiv.org/pdf/2208.12214
"Overbook in Advance, Trade in Future: Computing Resource Provisioning in Hybrid Device-Edge-<span class=""search-hit mathjax"">Cloud</span> Networks",https://arxiv.org/pdf/2208.11972
Efficient Data-Driven Network Functions,https://arxiv.org/pdf/2208.11385
In-Air Imaging Sonar Sensor Network with Real-Time Processing Using GPUs,https://arxiv.org/pdf/2208.10839
"LEAPER: Modeling <span class=""search-hit mathjax"">Cloud</span> FPGA-based Systems via Transfer Learning",https://arxiv.org/pdf/2208.10606
"PointDP: Diffusion-driven Purification against Adversarial Attacks on 3D Point <span class=""search-hit mathjax"">Cloud</span> Recognition",https://arxiv.org/pdf/2208.09801
"Zeno: A Scalable Capability-Based Secure <span class=""search-hit mathjax"">Architecture</span>",https://arxiv.org/pdf/2208.09800
Privacy-Preserving Protocols for Smart Cameras and Other IoT Devices,https://arxiv.org/pdf/2208.09776
"MonoPCNS: Monocular 3D Object Detection via Point <span class=""search-hit mathjax"">Cloud</span> Network Simulation",https://arxiv.org/pdf/2208.09446
"A Secure and Efficient Data Deduplication Scheme with Dynamic Ownership Management in <span class=""search-hit mathjax"">Cloud</span> Computing",https://arxiv.org/pdf/2208.09030
Z-BERT-A: a zero-shot Pipeline for Unknown Intent detection,https://arxiv.org/pdf/2208.07084
"Energy Savings When Migrating Workloads to the <span class=""search-hit mathjax"">Cloud</span>",https://arxiv.org/pdf/2208.06976
"PointTree: Transformation-Robust Point <span class=""search-hit mathjax"">Cloud</span> Encoder with Relaxed K-D Trees",https://arxiv.org/pdf/2208.05962
Design and Evaluation of IPFS: A Storage Layer for the Decentralized Web,https://arxiv.org/pdf/2208.05877
"Mission <span class=""search-hit mathjax"">Architecture</span> to Characterize Habitability of Venus <span class=""search-hit mathjax"">Cloud</span> Layers via an Aerial Platform",https://arxiv.org/pdf/2208.05582
Aerial Platform Design Options for a Life-Finding Mission at Venus,https://arxiv.org/pdf/2208.05579
"Federated Learning for Digital Twin-Based Vehicular Networks: <span class=""search-hit mathjax"">Architecture</span> and Challenges",https://arxiv.org/pdf/2208.05558
"PROFET: Profiling-based CNN Training Latency Prophet for GPU <span class=""search-hit mathjax"">Cloud</span> Instances",https://arxiv.org/pdf/2208.05130
Privacy-Aware Adversarial Network in Human Mobility Prediction,https://arxiv.org/pdf/2208.05009
Learning Mean-Field Control for Delayed Information Load Balancing in Large Queuing Systems,https://arxiv.org/pdf/2208.04777
"Global Hierarchical Attention for 3D Point <span class=""search-hit mathjax"">Cloud</span> Analysis",https://arxiv.org/pdf/2208.03791
"Hardless: A Generalized Serverless Compute <span class=""search-hit mathjax"">Architecture</span> for Hardware Processing Accelerators",https://arxiv.org/pdf/2208.03192
PointConvFormer: Revenge of the Point-based Convolution,https://arxiv.org/pdf/2208.02879
Distributed Intelligence in Wireless Networks,https://arxiv.org/pdf/2208.00545
"CloudAttention: Efficient Multi-Scale Attention Scheme For 3D Point <span class=""search-hit mathjax"">Cloud</span> Learning",https://arxiv.org/pdf/2208.00524
A Local-Ratio-Based Power Control Approach for Capacitated Access Points in Mobile Edge Computing,https://arxiv.org/pdf/2208.00372
"PolarMix: A General Data Augmentation Technique for LiDAR Point <span class=""search-hit mathjax"">Clouds</span>",https://arxiv.org/pdf/2208.00223
Renting Edge Computing Resources for Service Hosting,https://arxiv.org/pdf/2207.14690
CoNet: Borderless and decentralized server cooperation in edge computing,https://arxiv.org/pdf/2207.13991
Software Engineering for Serverless Computing,https://arxiv.org/pdf/2207.13263
"Explaining Deep Neural Networks for Point <span class=""search-hit mathjax"">Clouds</span> using Gradient-based Visualisations",https://arxiv.org/pdf/2207.12984
CENet: Toward Concise and Efficient LiDAR Semantic Segmentation for Autonomous Driving,https://arxiv.org/pdf/2207.12691
Interference and Need Aware Workload Colocation in Hyperscale Datacenters,https://arxiv.org/pdf/2207.12499
"RSAM: An Enhanced <span class=""search-hit mathjax"">Architecture</span> for achieving Web Services Reliability in Mobile <span class=""search-hit mathjax"">Cloud</span> Computing",https://arxiv.org/pdf/2207.12404
"Aveiro Tech City Living Lab: A Communication, Sensing and Computing Platform for City Environments",https://arxiv.org/pdf/2207.12200
Machine-learning accelerated identification of exfoliable two-dimensional materials,https://arxiv.org/pdf/2207.12118
Learning State Machines to Monitor and Detect Anomalies on a Kubernetes Cluster,https://arxiv.org/pdf/2207.12087
FAB: An FPGA-based Accelerator for Bootstrappable Fully Homomorphic Encryption,https://arxiv.org/pdf/2207.11872
SQP: Congestion Control for Low-Latency Interactive Video Streaming,https://arxiv.org/pdf/2207.11857
"CARGO: AI-Guided Dependency Analysis for Migrating Monolithic Applications to Microservices <span class=""search-hit mathjax"">Architecture</span>",https://arxiv.org/pdf/2207.11784
"RMAWS: An Hybrid <span class=""search-hit mathjax"">Architecture</span> for achieving Web Services Reliability in Mobile <span class=""search-hit mathjax"">Cloud</span> Computing",https://arxiv.org/pdf/2207.11608
"GraphFit: Learning Multi-scale Graph-Convolutional Representation for Point <span class=""search-hit mathjax"">Cloud</span> Normal Estimation",https://arxiv.org/pdf/2207.11484
The Dirty Secret of SSDs: Embodied Carbon,https://arxiv.org/pdf/2207.10793
"R2P: A Deep Learning Model from mmWave Radar to Point <span class=""search-hit mathjax"">Cloud</span>",https://arxiv.org/pdf/2207.10690
"Online Localisation and Colored Mesh Reconstruction <span class=""search-hit mathjax"">Architecture</span> for 3D Visual Feedback in Robotic Exploration Missions",https://arxiv.org/pdf/2207.10489
MeshMAE: Masked Autoencoders for 3D Mesh Data Analysis,https://arxiv.org/pdf/2207.10228
Implementacion de un sistema IoT de bajo costo para el monitoreo de la calidad del aire en El Salvador,https://arxiv.org/pdf/2207.09975
"An Intelligent Trust <span class=""search-hit mathjax"">Cloud</span> Management Method for Secure Clustering in 5G enabled Internet of Medical Things",https://arxiv.org/pdf/2207.09057
"PackCache: An Online Cost-driven Data Caching Algorithm in the <span class=""search-hit mathjax"">Cloud</span>",https://arxiv.org/pdf/2207.09035
I2I: Image to Icosahedral Projection for $\mathrm{SO}(3)$ Object Reasoning from Single-View Images,https://arxiv.org/pdf/2207.08925
"CATRE: Iterative Point <span class=""search-hit mathjax"">Clouds</span> Alignment for Category-level Object Pose Refinement",https://arxiv.org/pdf/2207.08082
"3DVerifier: Efficient Robustness Verification for 3D Point <span class=""search-hit mathjax"">Cloud</span> Models",https://arxiv.org/pdf/2207.07539
"Bi-PointFlowNet: Bidirectional Learning for Point <span class=""search-hit mathjax"">Cloud</span> Based Scene Flow Estimation",https://arxiv.org/pdf/2207.07522
ERIC: An Efficient and Practical Software Obfuscation Framework,https://arxiv.org/pdf/2207.07407
Bunk8s: Enabling Easy Integration Testing of Microservices in Kubernetes,https://arxiv.org/pdf/2207.06811
"Explainable Intrusion Detection Systems (X-IDS): A Survey of Current Methods, Challenges, and Opportunities",https://arxiv.org/pdf/2207.06236
Teachers in concordance for pseudo-labeling of 3D sequential data,https://arxiv.org/pdf/2207.06079
"A Near Sensor Edge Computing System for Point <span class=""search-hit mathjax"">Cloud</span> Semantic Segmentation",https://arxiv.org/pdf/2207.05888
Microservices-based IoT Applications Scheduling in Edge and Fog Computing: A Taxonomy and Future Directions,https://arxiv.org/pdf/2207.05399
Accelerating Large-Scale Graph-based Nearest Neighbor Search on a Computational Storage Platform,https://arxiv.org/pdf/2207.05241
"The SPEC-RG Reference <span class=""search-hit mathjax"">Architecture</span> for the Edge Continuum",https://arxiv.org/pdf/2207.04159
Authentication Devices in Fog-Mobile Edge Computing Environments Through a Wireless Grid Resource Sharing Protocol,https://arxiv.org/pdf/2207.03346
"PointMCD: Boosting Deep Point <span class=""search-hit mathjax"">Cloud</span> Encoders via Multi-view Cross-modal Distillation for 3D Shape Recognition",https://arxiv.org/pdf/2207.03128
Implementing Reinforcement Learning Datacenter Congestion Control in NVIDIA NICs,https://arxiv.org/pdf/2207.02295
Efficient Spatial-Temporal Information Fusion for LiDAR-Based 3D Moving Object Segmentation,https://arxiv.org/pdf/2207.02201
Learnings from an Under the Hood Analysis of an Object Storage Node IO Stack,https://arxiv.org/pdf/2207.01849
"The Dichotomy of <span class=""search-hit mathjax"">Cloud</span> and IoT: <span class=""search-hit mathjax"">Cloud</span>-Assisted IoT From a Security Perspective",https://arxiv.org/pdf/2207.01590
"Open-world Semantic Segmentation for LIDAR Point <span class=""search-hit mathjax"">Clouds</span>",https://arxiv.org/pdf/2207.01452
KubeAdaptor: A Docking Framework for Workflow Containerization on Kubernetes,https://arxiv.org/pdf/2207.01222
Sustainable AI Processing at the Edge,https://arxiv.org/pdf/2207.01209
"Enhancing Local Geometry Learning for 3D Point <span class=""search-hit mathjax"">Cloud</span> via Decoupling Convolution",https://arxiv.org/pdf/2207.01181
You Only Need One Detector: Unified Object Detector for Different Modalities based on Vision Transformers,https://arxiv.org/pdf/2207.01071
On the Performance of Data Compression in Clustered Fog Radio Access Networks,https://arxiv.org/pdf/2207.00223
An Analytical Study on Functional Split in Martian 3D Networks,https://arxiv.org/pdf/2207.00153
DarKnight: An Accelerated Framework for Privacy and Integrity Preserving Deep Learning Using Trusted Hardware,https://arxiv.org/pdf/2207.00083
"A Time Series Forecasting Approach to Minimize Cold Start Time in <span class=""search-hit mathjax"">Cloud</span>-Serverless Platform",https://arxiv.org/pdf/2206.15176
Assessing Intel's Memory Bandwidth Allocation for resource limitation in real-time systems,https://arxiv.org/pdf/2206.14637
"The Astronomy Commons Platform: A Deployable <span class=""search-hit mathjax"">Cloud</span>-Based Analysis Platform for Astronomy",https://arxiv.org/pdf/2206.14392
SSL-Lanes: Self-Supervised Learning for Motion Forecasting in Autonomous Driving,https://arxiv.org/pdf/2206.14116
Low Altitude 3-D Coverage Performance Analysis in Cell-Free Distributed Collaborative Massive MIMO Systems,https://arxiv.org/pdf/2206.13722
"WebAssembly as a Common Layer for the <span class=""search-hit mathjax"">Cloud</span>-edge Continuum",https://arxiv.org/pdf/2206.12888
"BIMS-PU: Bi-Directional and Multi-Scale Point <span class=""search-hit mathjax"">Cloud</span> Upsampling",https://arxiv.org/pdf/2206.12648
Contrastive Learning of Features between Images and LiDAR,https://arxiv.org/pdf/2206.12071
"System <span class=""search-hit mathjax"">Architecture</span> and Communication Infrastructure for the RoboVaaS project",https://arxiv.org/pdf/2206.11082
Blockchain Function Virtualization: A New Approach for Mobile Networks Beyond 5G,https://arxiv.org/pdf/2206.11074
On the effectiveness of persistent homology,https://arxiv.org/pdf/2206.10551
ORFD: A Dataset and Benchmark for Off-Road Freespace Detection,https://arxiv.org/pdf/2206.09907
Vehicle-to-Vehicle Charging Coordination over Information Centric Networking,https://arxiv.org/pdf/2206.09310
Channel-wise Mixed-precision Assignment for DNN Inference on Constrained Edge Nodes,https://arxiv.org/pdf/2206.08852
"Belief-Desire-Intention (BDI) Multi-agent System for <span class=""search-hit mathjax"">Cloud</span> Marketplace Negotiation",https://arxiv.org/pdf/2206.08468
Deployment of AGRI-BOT in Greenhouse Administration,https://arxiv.org/pdf/2206.07266
Revealing the Mysteries of Venus: The DAVINCI Mission,https://arxiv.org/pdf/2206.07211
"VSC-WebGPU: A Selenium-based VS Code Extension For Local Edit And <span class=""search-hit mathjax"">Cloud</span> Compilation on WebGPU",https://arxiv.org/pdf/2206.06428
A Hybrid Artificial Neural Network for Task Offloading in Mobile Edge Computing,https://arxiv.org/pdf/2206.06301
Global Internet public peering capacity of interconnection: a complex network analysis,https://arxiv.org/pdf/2206.05146
Subjective Quality Assessment for Images Generated by Computer Graphics,https://arxiv.org/pdf/2206.05008
PointNeXt: Revisiting PointNet++ with Improved Training and Scaling Strategies,https://arxiv.org/pdf/2206.04670
VN-Transformer: Rotation-Equivariant Attention for Vector Neurons,https://arxiv.org/pdf/2206.04176
Nezha: Deployable and High-Performance Consensus Using Synchronized Clocks,https://arxiv.org/pdf/2206.03285
"Exploration of Systolic-Vector <span class=""search-hit mathjax"">Architecture</span> with Resource Scheduling for Dynamic ML Workloads",https://arxiv.org/pdf/2206.03060
No GPU? No problem: an ultra fast 3D detection of road users with a simple proposal generator and energy-based out-of-distribution PointNets,https://arxiv.org/pdf/2206.02597
BenchFaaS: Benchmarking Serverless Functions in an Edge Computing Network Testbed,https://arxiv.org/pdf/2206.02150
End-to-End Security for Distributed Event-Driven Enclave Applications on Heterogeneous TEEs,https://arxiv.org/pdf/2206.01041
"6G Survey on Challenges, Requirements, Applications, Key Enabling Technologies, Use Cases, AI integration issues and Security aspects",https://arxiv.org/pdf/2206.00868
"Optimal <span class=""search-hit mathjax"">Cloud</span> Network Control with Strict Latency Constraints",https://arxiv.org/pdf/2205.15556
itKD: Interchange Transfer-based Knowledge Distillation for 3D Object Detection,https://arxiv.org/pdf/2205.15531
"CTR: Checkpoint, Transfer, and Restore for Secure Enclaves",https://arxiv.org/pdf/2205.15359
QFaaS: A Serverless Function-as-a-Service Framework for Quantum Computing,https://arxiv.org/pdf/2205.14845
Dynamic Control of Data-Intensive Services over Edge Computing Networks,https://arxiv.org/pdf/2205.14735
"Heterogeneous Data-Centric <span class=""search-hit mathjax"">Architectures</span> for Modern Data-Intensive Applications: Case Studies in Machine Learning and Databases",https://arxiv.org/pdf/2205.14664
"Point-M2AE: Multi-scale Masked Autoencoders for Hierarchical Point <span class=""search-hit mathjax"">Cloud</span> Pre-training",https://arxiv.org/pdf/2205.14401
"SHORTSTACK: Distributed, Fault-tolerant, Oblivious Data Access",https://arxiv.org/pdf/2205.14281
Ainur: A Framework for Repeatable End-to-End Wireless Edge Computing Testbed Research,https://arxiv.org/pdf/2205.14247
Service Provisioning in Mobile Environments through Opportunistic Computing,https://arxiv.org/pdf/2205.14110
BASALISC: Programmable Asynchronous Hardware Accelerator for BGV Fully Homomorphic Encryption,https://arxiv.org/pdf/2205.14017
Evolution as a Service: A Privacy-Preserving Genetic Algorithm for Combinatorial Optimization,https://arxiv.org/pdf/2205.13948
3DILG: Irregular Latent Grids for 3D Generative Modeling,https://arxiv.org/pdf/2205.13914
Task Offloading with Multi-Tier Computing Resources in Next Generation Wireless Networks,https://arxiv.org/pdf/2205.13866
Deep Sensor Fusion with Pyramid Fusion Networks for 3D Semantic Segmentation,https://arxiv.org/pdf/2205.13629
BEVFusion: Multi-Task Multi-Sensor Fusion with Unified Bird's-Eye View Representation,https://arxiv.org/pdf/2205.13542
"SemAffiNet: Semantic-Affine Transformation for Point <span class=""search-hit mathjax"">Cloud</span> Segmentation",https://arxiv.org/pdf/2205.13490
Scalable and Low-Latency Federated Learning with Cooperative Mobile Edge Networking,https://arxiv.org/pdf/2205.13054
"Non-rigid Point <span class=""search-hit mathjax"">Cloud</span> Registration with Neural Deformation Pyramid",https://arxiv.org/pdf/2205.12796
"sat2pc: Estimating Point <span class=""search-hit mathjax"">Cloud</span> of Building Roofs from 2D Satellite Images",https://arxiv.org/pdf/2205.12464
Robust 3D Object Detection in Cold Weather Conditions,https://arxiv.org/pdf/2205.11925
Rethinking Task-Incremental Learning Baselines,https://arxiv.org/pdf/2205.11367
Point is a Vector: A Feature Representation in Point Analysis,https://arxiv.org/pdf/2205.10528
"6G Network AI <span class=""search-hit mathjax"">Architecture</span> for Everyone-Centric Customized Services",https://arxiv.org/pdf/2205.09944
VNT-Net: Rotational Invariant Vector Neuron Transformers,https://arxiv.org/pdf/2205.09690
Multi-DNN Accelerators for Next-Generation AI Systems,https://arxiv.org/pdf/2205.09376
"Resilience Enhancement at Edge <span class=""search-hit mathjax"">Cloud</span> Systems",https://arxiv.org/pdf/2205.08997
SplitBFT: Improving Byzantine Fault Tolerance Safety Using Trusted Compartments,https://arxiv.org/pdf/2205.08938
Transparent Serverless execution of Python multiprocessing applications,https://arxiv.org/pdf/2205.08818
"Static analysis tools in the era of <span class=""search-hit mathjax"">cloud</span>-native systems",https://arxiv.org/pdf/2205.08527
Towards Resilient Access Equality for 6G Serverless p-LEO Satellite Networks,https://arxiv.org/pdf/2205.08430
A Comprehensive Study on Artificial Intelligence Algorithms to Implement Safety Using Communication Technologies,https://arxiv.org/pdf/2205.08404
LPC-AD: Fast and Accurate Multivariate Time Series Anomaly Detection via Latent Predictive Coding,https://arxiv.org/pdf/2205.08362
"Continual learning on 3D point <span class=""search-hit mathjax"">clouds</span> with random compressed rehearsal",https://arxiv.org/pdf/2205.08013
Hyperdimensional Hashing: A Robust and Efficient Dynamic Hash Table,https://arxiv.org/pdf/2205.07850
Multi-modal curb detection and filtering,https://arxiv.org/pdf/2205.07096
"Energy Efficient UAV-Based Service Offloading over <span class=""search-hit mathjax"">Cloud</span>-Fog <span class=""search-hit mathjax"">Architectures</span>",https://arxiv.org/pdf/2205.07079
"Blockchain Goes Green? Part II: Characterizing the Performance and Cost of Blockchains on the <span class=""search-hit mathjax"">Cloud</span> and at the Edge",https://arxiv.org/pdf/2205.06941
Task Allocation for Energy Optimization in Fog Computing Networks with Latency Constraints,https://arxiv.org/pdf/2205.06531
Massively Scalable Wavelength Diverse Integrated Photonic Linear Neuron,https://arxiv.org/pdf/2205.06180
"A Qualitative Evaluation of Service Mesh-based Traffic Management for Mobile Edge <span class=""search-hit mathjax"">Cloud</span>",https://arxiv.org/pdf/2205.06057
Trusted Container Extensions for Container-based Confidential Computing,https://arxiv.org/pdf/2205.05747
Building Automation System Data Integration with BIM: Data Structure and Supporting Case Study,https://arxiv.org/pdf/2205.05518
"Uptime-Optimized <span class=""search-hit mathjax"">Cloud</span> <span class=""search-hit mathjax"">Architecture</span> as a Brokered Service",https://arxiv.org/pdf/2205.05403
Practical application-specific advantage through hybrid quantum computing,https://arxiv.org/pdf/2205.04858
"An Edge-<span class=""search-hit mathjax"">Cloud</span> Integrated Framework for Flexible and Dynamic Stream Analytics",https://arxiv.org/pdf/2205.04622
Multiview Stereo with Cascaded Epipolar RAFT,https://arxiv.org/pdf/2205.04502
"<span class=""search-hit mathjax"">Architectural</span> Partitioning and Deployment Modeling on Hybrid <span class=""search-hit mathjax"">Clouds</span>",https://arxiv.org/pdf/2205.04467
NEPTUNE: Network- and GPU-aware Management of Serverless Functions at the Edge,https://arxiv.org/pdf/2205.04320
FoReCo: a forecast-based recovery mechanism for real-time remote control of robotic manipulators,https://arxiv.org/pdf/2205.04189
"RobotCore: An Open <span class=""search-hit mathjax"">Architecture</span> for Hardware Acceleration in ROS 2",https://arxiv.org/pdf/2205.03929
"SoftPool++: An Encoder-Decoder Network for Point <span class=""search-hit mathjax"">Cloud</span> Completion",https://arxiv.org/pdf/2205.03899
A Multi-User Effective Computation Offloading Mechanism for MEC System: Batched Multi-Armed Bandits Approach,https://arxiv.org/pdf/2205.03781
Private delegated computations using strong isolation,https://arxiv.org/pdf/2205.03322
Low Dimensional Invariant Embeddings for Universal Geometric Learning,https://arxiv.org/pdf/2205.02956
Edge-enabled Metaverse: The Convergence of Metaverse and Mobile Edge Computing,https://arxiv.org/pdf/2205.02764
"Ultra-Reliable Distributed <span class=""search-hit mathjax"">Cloud</span> Network Control with End-to-End Latency Constraints",https://arxiv.org/pdf/2205.02427
Improved Orientation Estimation and Detection with Hybrid Object Detection Networks for Automotive Radar,https://arxiv.org/pdf/2205.02111
Planning a Cost-Effective Delay-Constrained Passive Optical Network for 5G Fronthaul,https://arxiv.org/pdf/2205.02055
Joint Compute-Caching-Communication Control for Online Data-Intensive Service Delivery,https://arxiv.org/pdf/2205.01944
Three-dimensional Geospatial Interlinking with JedAI-spatial,https://arxiv.org/pdf/2205.01905
"Autonomy and Intelligence in the Computing Continuum: Challenges, Enablers, and Future Directions for Orchestration",https://arxiv.org/pdf/2205.01423
"A Global Operational Readiness Review Process: Improving <span class=""search-hit mathjax"">Cloud</span> Availability",https://arxiv.org/pdf/2205.01372
Scalable Tail Latency Estimation for Data Center Networks,https://arxiv.org/pdf/2205.01234
Auto-scaling HTCondor pools using Kubernetes compute resources,https://arxiv.org/pdf/2205.01004
La Résistance: Harnessing Heterogeneous Resources for Adaptive Resiliency in 6G Networks,https://arxiv.org/pdf/2205.00821
DFC: Anatomically Informed Fiber Clustering with Self-supervised Deep Learning for Fast and Effective Tractography Parcellation,https://arxiv.org/pdf/2205.00627
"Latent Space Explorer: Unsupervised Data Pattern Discovery on the <span class=""search-hit mathjax"">Cloud</span>",https://arxiv.org/pdf/2204.13933
Deployment of an IoT System for Adaptive In-Situ Soundscape Augmentation,https://arxiv.org/pdf/2204.13890
FPIRM: Floating-point Processing in Racetrack Memories,https://arxiv.org/pdf/2204.13788
