"Towards Efficient Point <span class=""search-hit mathjax"">Cloud</span> Graph Neural Networks Through <span class=""search-hit mathjax"">Architectural</span> Simplification",https://arxiv.org/pdf/2108.06317
"Open comments on the Task Force SIRS report: Scholarly Infrastructures for Research Software (EOSC Executive Board, EOSCArchitecture)",https://arxiv.org/pdf/2108.06127
"PVT: Point-Voxel Transformer for Point <span class=""search-hit mathjax"">Cloud</span> Learning",https://arxiv.org/pdf/2108.06076
Combinatorial Resources Auction in Decentralized Edge-Thing Systems Using Blockchain and Differential Privacy,https://arxiv.org/pdf/2108.05567
HandFoldingNet: A 3D Hand Pose Estimation Network Using Multiscale-Feature Guided Folding of a 2D Hand Skeleton,https://arxiv.org/pdf/2108.05545
"Serverless <span class=""search-hit mathjax"">Architecture</span> for Service Robot Management System",https://arxiv.org/pdf/2108.04531
Suppression of crosstalk in superconducting qubits using dynamical decoupling,https://arxiv.org/pdf/2108.04530
"DRINet: A Dual-Representation Iterative Learning Network for Point <span class=""search-hit mathjax"">Cloud</span> Segmentation",https://arxiv.org/pdf/2108.04023
A new step for computing,https://arxiv.org/pdf/2108.03997
Adaptive Anomaly Detection for Internet of Things in Hierarchical Edge Computing: A Contextual-Bandit Approach,https://arxiv.org/pdf/2108.03872
Master Graduation Thesis: A Lightweight and Distributed Container-based Framework,https://arxiv.org/pdf/2108.03562
NASOA: Towards Faster Task-oriented Online Fine-tuning with a Zoo of Models,https://arxiv.org/pdf/2108.03434
"Artificial Intelligence-Driven Customized Manufacturing Factory: Key Technologies, Applications, and Challenges",https://arxiv.org/pdf/2108.03383
FloMore: Meeting bandwidth requirements of flows,https://arxiv.org/pdf/2108.03221
Molecule Generation Experience: An Open Platform of Material Design for Public Users,https://arxiv.org/pdf/2108.03044
3DRIMR: 3D Reconstruction and Imaging via mmWave Radar based on Deep Learning,https://arxiv.org/pdf/2108.02858
User modeling for social and affective robots,https://arxiv.org/pdf/2108.02513
TransRefer3D: Entity-and-Relation Aware Transformer for Fine-Grained 3D Visual Grounding,https://arxiv.org/pdf/2108.02388
Hefei light source storage ring bunch by bunch 3D position measuring system is introduced and a preliminary study is shown,https://arxiv.org/pdf/2108.00988
Resource Management in Edge and Fog Computing using FogBus2 Framework,https://arxiv.org/pdf/2108.00591
Internet of things: a multiprotocol gateway as solution of the interoperability problem,https://arxiv.org/pdf/2108.00098
Touching the Stars: Using High-Resolution 3D Printing to Visualize Stellar Nurseries,https://arxiv.org/pdf/2108.00014
"Pix2Point: Learning Outdoor 3D Using Sparse Point <span class=""search-hit mathjax"">Clouds</span> and Optimal Transport",https://arxiv.org/pdf/2107.14498
From Multi-View to Hollow-3D: Hallucinated Hollow-3D R-CNN for 3D Object Detection,https://arxiv.org/pdf/2107.14391
"Distributed Smart Measurement <span class=""search-hit mathjax"">Architecture</span> for Industrial Automation",https://arxiv.org/pdf/2107.14272
"Point-<span class=""search-hit mathjax"">Cloud</span> Deep Learning of Porous Media for Permeability Prediction",https://arxiv.org/pdf/2107.14038
Accelerating advection for atmospheric modelling on Xilinx and Intel FPGAs,https://arxiv.org/pdf/2107.13500
CarveNet: Carving Point-Block for Complex 3D Shape Completion,https://arxiv.org/pdf/2107.13452
"5G Multi-access Edge Computing: Security, Dependability, and Performance",https://arxiv.org/pdf/2107.13374
AA3DNet: Attention Augmented Real Time 3D Object Detection,https://arxiv.org/pdf/2107.12137
"Score-Based Point <span class=""search-hit mathjax"">Cloud</span> Denoising (Learning Gradient Fields for Point <span class=""search-hit mathjax"">Cloud</span> Denoising)",https://arxiv.org/pdf/2107.10981
"SAGE: A Split-<span class=""search-hit mathjax"">Architecture</span> Methodology for Efficient End-to-End Autonomous Vehicle Control",https://arxiv.org/pdf/2107.10895
Digital Einstein Experience: Fast Text-to-Speech for Conversational AI,https://arxiv.org/pdf/2107.10658
mmPose-NLP: A Natural Language Processing Approach to Precise Skeletal Pose Estimation using mmWave Radars,https://arxiv.org/pdf/2107.10327
"Correspondence-Free Point <span class=""search-hit mathjax"">Cloud</span> Registration with SO(3)-Equivariant Implicit Shape Representations",https://arxiv.org/pdf/2107.10296
"<span class=""search-hit mathjax"">Architecture</span>-Specific Performance Optimization of Compute-Intensive FaaS Functions",https://arxiv.org/pdf/2107.10008
"A Point <span class=""search-hit mathjax"">Cloud</span> Generative Model via Tree-Structured Graph Convolutions for 3D Brain Shape Reconstruction",https://arxiv.org/pdf/2107.09923
Mono2Micro: A Practical and Effective Tool for Decomposing Monolithic Java Applications to Microservices,https://arxiv.org/pdf/2107.09698
Into Summarization Techniques for IoT Data Discovery Routing,https://arxiv.org/pdf/2107.09558
"LENS: Layer Distribution Enabled Neural <span class=""search-hit mathjax"">Architecture</span> Search in Edge-<span class=""search-hit mathjax"">Cloud</span> Hierarchies",https://arxiv.org/pdf/2107.09309
Online Deployment Algorithms for Microservice Systems with Complex Dependencies,https://arxiv.org/pdf/2107.09308
Latency-Memory Optimized Splitting of Convolution Neural Networks for Resource Constrained Edge Devices,https://arxiv.org/pdf/2107.09123
Learning point embedding for 3D data processing,https://arxiv.org/pdf/2107.08565
"Dynamic Convolution for 3D Point <span class=""search-hit mathjax"">Cloud</span> Instance Segmentation",https://arxiv.org/pdf/2107.08392
"LAORAM: A Look Ahead ORAM <span class=""search-hit mathjax"">Architecture</span> for Training Large Embedding Tables",https://arxiv.org/pdf/2107.08094
DxHash: A Scalable Consistent Hash Based on the Pseudo-Random Sequence,https://arxiv.org/pdf/2107.07930
An Energy-Efficient Edge Computing Paradigm for Convolution-based Image Upsampling,https://arxiv.org/pdf/2107.07647
"CLEDGE: A Hybrid <span class=""search-hit mathjax"">Cloud</span>-Edge Computing Framework over Information Centric Networking",https://arxiv.org/pdf/2107.07604
Design and Implementation of an IoT Based LPG and CO Gases Monitoring System,https://arxiv.org/pdf/2107.07406
"Person-MinkUNet: 3D Person Detection with LiDAR Point <span class=""search-hit mathjax"">Cloud</span>",https://arxiv.org/pdf/2107.06780
FLAT: An Optimized Dataflow for Mitigating Attention Bottlenecks,https://arxiv.org/pdf/2107.06419
Implementing a LoRa Software-Defined Radio on a General-Purpose ULP Microcontroller,https://arxiv.org/pdf/2107.05584
Astro-COLIBRI: a new platform for real-time multi-messenger astrophysics,https://arxiv.org/pdf/2107.05335
"Offloading Optimization with Delay Distribution in the 3-tier Federated <span class=""search-hit mathjax"">Cloud</span>, Edge, and Fog Systems",https://arxiv.org/pdf/2107.05015
Convergence of 5G with Internet of Things for Enhanced Privacy,https://arxiv.org/pdf/2107.04594
Serverless Computing: A Security Perspective,https://arxiv.org/pdf/2107.03832
LanguageRefer: Spatial-Language Model for 3D Visual Grounding,https://arxiv.org/pdf/2107.03438
Learning Stixel-based Instance Segmentation,https://arxiv.org/pdf/2107.03070
"Learning Semantic Segmentation of Large-Scale Point <span class=""search-hit mathjax"">Clouds</span> with Random Sampling",https://arxiv.org/pdf/2107.02389
"Energy and Thermal-aware Resource Management of <span class=""search-hit mathjax"">Cloud</span> Data Centres: A Taxonomy and Future Directions",https://arxiv.org/pdf/2107.02342
"A Serverless <span class=""search-hit mathjax"">Cloud</span> Integration For Quantum Computing",https://arxiv.org/pdf/2107.02007
SEC-NoSQL: Towards Implementing High Performance Security-as-a-Service for NoSQL Databases,https://arxiv.org/pdf/2107.01640
Scene-aware Learning Network for Radar Object Detection,https://arxiv.org/pdf/2107.01469
Traffic Generation for Benchmarking Data Centre Networks,https://arxiv.org/pdf/2107.01398
"Cyber Security in <span class=""search-hit mathjax"">Cloud</span>: Risk Assessment Models",https://arxiv.org/pdf/2107.01007
Resilient and Latency-aware Orchestration of Network Slices Using Multi-connectivity in MEC-enabled 5G Networks,https://arxiv.org/pdf/2107.00618
Scrooge Attack: Undervolting ARM Processors for Profit,https://arxiv.org/pdf/2107.00416
"Variational secure <span class=""search-hit mathjax"">cloud</span> quantum computing",https://arxiv.org/pdf/2106.15770
"Model-Centric Volumetric Point <span class=""search-hit mathjax"">Cloud</span> Attributes",https://arxiv.org/pdf/2106.15539
AdaptiveFog: A Modelling and Optimization Framework for Fog Computing in Intelligent Transportation Systems,https://arxiv.org/pdf/2106.15477
undeSErVed trust: Exploiting Permutation-Agnostic Remote Attestation,https://arxiv.org/pdf/2106.15387
"SE-MD: A Single-encoder multiple-decoder deep network for point <span class=""search-hit mathjax"">cloud</span> generation from 2D images",https://arxiv.org/pdf/2106.15325
Implementation and Evaluation of Data Center Congestion Controller with Switch Assistance,https://arxiv.org/pdf/2106.14100
Evaluation of Cache Attacks on Arm Processors and Secure Caches,https://arxiv.org/pdf/2106.14054
rFaaS: Enabling High Performance Serverless with RDMA and Decentralization,https://arxiv.org/pdf/2106.13859
Shape registration in the time of transformers,https://arxiv.org/pdf/2106.13679
Crossing Cross-Domain Paths in the Current Web,https://arxiv.org/pdf/2106.13478
Real-time Outdoor Localization Using Radio Maps: A Deep Learning Approach,https://arxiv.org/pdf/2106.12556
"ESAI: Efficient Split Artificial Intelligence via Early Exiting Using Neural <span class=""search-hit mathjax"">Architecture</span> Search",https://arxiv.org/pdf/2106.12549
Combination of Convolutional Neural Network and Gated Recurrent Unit for Energy Aware Resource Allocation,https://arxiv.org/pdf/2106.12178
The Interplay of Reconfigurable Intelligent Surfaces and Mobile Edge Computing in Future Wireless Networks: A Win-Win Strategy to 6G,https://arxiv.org/pdf/2106.11784
"Over-the-Air Computation via <span class=""search-hit mathjax"">Cloud</span> Radio Access Networks",https://arxiv.org/pdf/2106.11649
V-Edge: Virtual Edge Computing as an Enabler for Novel Microservices and Cooperative Computing,https://arxiv.org/pdf/2106.10063
"Training or <span class=""search-hit mathjax"">Architecture</span>? How to Incorporate Invariance in Neural Networks",https://arxiv.org/pdf/2106.10044
Software-Defined Networking for Data Centre Network Management: A Survey,https://arxiv.org/pdf/2106.10014
"Latency-aware and Survivable Mapping of VNFs in 5G Network Edge <span class=""search-hit mathjax"">Cloud</span>",https://arxiv.org/pdf/2106.09849
Fogging Jyaguchi Services in Tensai Gothalo,https://arxiv.org/pdf/2106.07866
PolarStream: Streaming Lidar Object Detection and Segmentation with Polar Pillars,https://arxiv.org/pdf/2106.07545
"Low cost <span class=""search-hit mathjax"">cloud</span> based remote microscopy for biological sciences",https://arxiv.org/pdf/2106.07419
Online Estimation of Resource Overload Risk in 5G Multi-Tenancy Network,https://arxiv.org/pdf/2106.07417
"Acceleration-as-a-μService: A <span class=""search-hit mathjax"">Cloud</span>-native Monte-Carlo Option Pricing Engine on CPUs, GPUs and Disaggregated FPGAs",https://arxiv.org/pdf/2106.06293
Where to Encode: A Performance Analysis of x86 and Arm-based Amazon EC2 Instances,https://arxiv.org/pdf/2106.06242
"Revisiting Point <span class=""search-hit mathjax"">Cloud</span> Shape Classification with a Simple and Effective Baseline",https://arxiv.org/pdf/2106.05304
Workflows Community Summit: Advancing the State-of-the-art of Scientific Workflows Management Systems Research and Development,https://arxiv.org/pdf/2106.05177
DNS attack mitigation Using OpenStack Isolation,https://arxiv.org/pdf/2106.04575
"Image2Point: 3D Point-<span class=""search-hit mathjax"">Cloud</span> Understanding with 2D Image Pretrained Models",https://arxiv.org/pdf/2106.04180
Analyzing Open-Source Serverless Platforms: Characteristics and Performance,https://arxiv.org/pdf/2106.03601
"Unsupervised Learning for Cuboid Shape Abstraction via Joint Segmentation from Point <span class=""search-hit mathjax"">Clouds</span>",https://arxiv.org/pdf/2106.03437
"Point <span class=""search-hit mathjax"">Cloud</span> Failure Criterion for Composites using k-Nearest Neighbor Classification",https://arxiv.org/pdf/2106.02714
"An Intelligent Resource Reservation for Crowdsourced Live Video Streaming Applications in Geo-Distributed <span class=""search-hit mathjax"">Cloud</span> Environment",https://arxiv.org/pdf/2106.02420
SE(3)-equivariant prediction of molecular wavefunctions and electronic densities,https://arxiv.org/pdf/2106.02347
"<span class=""search-hit mathjax"">Cloud</span>-Enabled High-Altitude Platform Systems: Challenges and Opportunities",https://arxiv.org/pdf/2106.02006
"DeepCompress: Efficient Point <span class=""search-hit mathjax"">Cloud</span> Geometry Compression",https://arxiv.org/pdf/2106.01504
"Dagger: Accelerating RPCs in <span class=""search-hit mathjax"">Cloud</span> Microservices Through Tightly-Coupled Reconfigurable NICs",https://arxiv.org/pdf/2106.01482
Energy-aware optimization of UAV base stations placement via decentralized multi-agent Q-learning,https://arxiv.org/pdf/2106.00845
"Dynamic-Deep: Tune ECG Task Performance and Optimize Compression in IoT <span class=""search-hit mathjax"">Architectures</span>",https://arxiv.org/pdf/2106.00606
Triggerflow: Trigger-based Orchestration of Serverless Workflows,https://arxiv.org/pdf/2106.00583
"Optimal virtual PON slicing to support ultra-low latency mesh traffic pattern in MEC-based <span class=""search-hit mathjax"">Cloud</span>-RAN",https://arxiv.org/pdf/2106.00569
"DLA-Net: Learning Dual Local Attention Features for Semantic Segmentation of Large-Scale Building Facade Point <span class=""search-hit mathjax"">Clouds</span>",https://arxiv.org/pdf/2106.00376
Energy and Network Aware Workload Management for Geographically Distributed Data Centers,https://arxiv.org/pdf/2106.00066
Deep Reinforcement Based Optimization of Function Splitting in Virtualized Radio Access Networks,https://arxiv.org/pdf/2105.14731
SMURF: Efficient and Scalable Metadata Access for Distributed Applications,https://arxiv.org/pdf/2105.14157
"<span class=""search-hit mathjax"">Cloud</span> Collectives: Towards <span class=""search-hit mathjax"">Cloud</span>-aware Collectives forML Workloads with Rank Reordering",https://arxiv.org/pdf/2105.14088
An Analysis of Amazon Echo's Network Behavior,https://arxiv.org/pdf/2105.13500
"Sinan: Data-Driven, QoS-Aware Cluster Management for Microservices",https://arxiv.org/pdf/2105.13424
A Review on Applications and Challenges in Internet of Things,https://arxiv.org/pdf/2105.12835
"Anomaly Detection and Failure Root Cause Analysis in (Micro)Service-Based <span class=""search-hit mathjax"">Cloud</span> Applications: A Survey",https://arxiv.org/pdf/2105.12378
"TransLoc3D : Point <span class=""search-hit mathjax"">Cloud</span> based Large-scale Place Recognition using Adaptive Receptive Fields",https://arxiv.org/pdf/2105.11605
Neural Network Based Sleep Phases Classification for Resource Constraint Environments,https://arxiv.org/pdf/2105.11452
SAT: 2D Semantics Assisted Training for 3D Visual Grounding,https://arxiv.org/pdf/2105.11450
Revisiting 2D Convolutional Neural Networks for Graph-based Applications,https://arxiv.org/pdf/2105.11016
SPATO: A Student Project Allocation Based Task Offloading in IoT-Fog Systems,https://arxiv.org/pdf/2105.10715
Protocol Stack Perspective For Low Latency and Massive Connectivity in Future Cellular Networks,https://arxiv.org/pdf/2105.10666
"Functionals in the <span class=""search-hit mathjax"">Clouds</span>: An abstract <span class=""search-hit mathjax"">architecture</span> of serverless <span class=""search-hit mathjax"">Cloud</span>-Native Apps",https://arxiv.org/pdf/2105.10362
Chameleons on Cloudlets: Elastic Edge Computing Through Microservice Variants,https://arxiv.org/pdf/2105.10355
NetGraf: A Collaborative Network Monitoring Stack for Network Experimental Testbeds,https://arxiv.org/pdf/2105.10326
Energy Minimized Federated Fog Computing over Passive Optical Networks,https://arxiv.org/pdf/2105.10242
"Towards Automatic Sizing for PPE with a Point <span class=""search-hit mathjax"">Cloud</span> Based Variational Autoencoder",https://arxiv.org/pdf/2105.10067
Approximation Algorithms for the NFV Service Distribution Problem,https://arxiv.org/pdf/2105.10061
"Energy-Efficient Distributed Machine Learning in <span class=""search-hit mathjax"">Cloud</span> Fog Networks",https://arxiv.org/pdf/2105.10048
Stochastic Buffer-Aided Relay-Assisted MEC in Time-Slotted Systems,https://arxiv.org/pdf/2105.09463
Stochastic Coordination in Heterogeneous Load Balancing Systems,https://arxiv.org/pdf/2105.09389
Using Transformers to Provide Teachers with Personalized Feedback on their Classroom Discourse: The TalkMoves Application,https://arxiv.org/pdf/2105.07949
"Traffic-Aware Service Relocation in <span class=""search-hit mathjax"">Cloud</span>-Oriented Elastic Optical Networks",https://arxiv.org/pdf/2105.07653
Protein sequence-to-structure learning: Is this the end(-to-end revolution)?,https://arxiv.org/pdf/2105.07407
The Paradigm of Digital Twin Communications,https://arxiv.org/pdf/2105.07182
Rescue Network: Using UAVs (drones) in Earthquake Crisis Management,https://arxiv.org/pdf/2105.07172
Models of Computing as a Service and IoT: an analysis of the current scenario with applications using LPWAN,https://arxiv.org/pdf/2105.06050
Scaling Migrations and Replications of Virtual Network Functions based on Network Traffic Forecasting,https://arxiv.org/pdf/2105.04987
An improved tile-based scalable distributed management model of massive high-resolution satellite images,https://arxiv.org/pdf/2105.04731
SCTN: Sparse Convolution-Transformer Network for Scene Flow Estimation,https://arxiv.org/pdf/2105.04447
"AppealNet: An Efficient and Highly-Accurate Edge/<span class=""search-hit mathjax"">Cloud</span> Collaborative <span class=""search-hit mathjax"">Architecture</span> for DNN Inference",https://arxiv.org/pdf/2105.04104
SA-ConvONet: Sign-Agnostic Optimization of Convolutional Occupancy Networks,https://arxiv.org/pdf/2105.03582
Photonic Network Coding and Partial Protection for Optical Core Networks: Two for a Tango,https://arxiv.org/pdf/2105.03503
"Energy-Efficient AI over a Virtualized <span class=""search-hit mathjax"">Cloud</span> Fog Network",https://arxiv.org/pdf/2105.03221
ACORN: Adaptive Coordinate Networks for Neural Scene Representation,https://arxiv.org/pdf/2105.02788
Towards Inference Delivery Networks: Distributing Machine Learning with Optimality Guarantees,https://arxiv.org/pdf/2105.02510
Beyond Self-attention: External Attention using Two Linear Layers for Visual Tasks,https://arxiv.org/pdf/2105.02358
Pervasive AI for IoT applications: A Survey on Resource-efficient Distributed Artificial Intelligence,https://arxiv.org/pdf/2105.01798
"Pedestrian Detection in 3D Point <span class=""search-hit mathjax"">Clouds</span> using Deep Neural Networks",https://arxiv.org/pdf/2105.01151
"Deployment Archetypes for <span class=""search-hit mathjax"">Cloud</span> Applications",https://arxiv.org/pdf/2105.00560
Kubernetes Autoscaling: YoYo Attack Vulnerability and Mitigation,https://arxiv.org/pdf/2105.00542
Investigating the Impact of Multi-LiDAR Placement on Object Detection for Autonomous Driving,https://arxiv.org/pdf/2105.00373
Privacy and Integrity Preserving Training Using Trusted Hardware,https://arxiv.org/pdf/2105.00334
"Deep Convolution for Irregularly Sampled Temporal Point <span class=""search-hit mathjax"">Clouds</span>",https://arxiv.org/pdf/2105.00137
"DRAM Failure Prediction in AIOps: Empirical Evaluation, Challenges and Opportunities",https://arxiv.org/pdf/2104.15052
A Review on Bio-Cyber Interfaces for Intrabody Molecular Communications Systems,https://arxiv.org/pdf/2104.14944
MAGMA: An Optimization Framework for Mapping Multiple DNNs on Multiple Accelerator Cores,https://arxiv.org/pdf/2104.13997
"Cross-Level Cross-Scale Cross-Attention Network for Point <span class=""search-hit mathjax"">Cloud</span> Representation",https://arxiv.org/pdf/2104.13053
"Dual Transformer for Point <span class=""search-hit mathjax"">Cloud</span> Analysis",https://arxiv.org/pdf/2104.13044
"Security, Privacy and Trust: Cognitive Internet of Vehicles",https://arxiv.org/pdf/2104.12878
Semi-Decentralized Federated Edge Learning for Fast Convergence on Non-IID Data,https://arxiv.org/pdf/2104.12678
"Microservice Dynamic <span class=""search-hit mathjax"">Architecture</span>-Level Deployment Orchestration (Extended Version)",https://arxiv.org/pdf/2104.12466
"ECLIPSE : Envisioning <span class=""search-hit mathjax"">CLoud</span> Induced Perturbations in Solar Energy",https://arxiv.org/pdf/2104.12419
"M3DeTR: Multi-representation, Multi-scale, Mutual-relation 3D Object Detection with Transformers",https://arxiv.org/pdf/2104.11896
"BEVDetNet: Bird's Eye View LiDAR Point <span class=""search-hit mathjax"">Cloud</span> based Real-time 3D Object Detection for Autonomous Driving",https://arxiv.org/pdf/2104.10780
Carbon Emissions and Large Neural Network Training,https://arxiv.org/pdf/2104.10350
Variational Relational Point Completion Network,https://arxiv.org/pdf/2104.10154
Geometric Deep Learning on Anatomical Meshes for the Prediction of Alzheimer's Disease,https://arxiv.org/pdf/2104.10047
"Multiscale deep context modeling for lossless point <span class=""search-hit mathjax"">cloud</span> geometry compression",https://arxiv.org/pdf/2104.09859
Leveraging Public-Private Blockchain Interoperability for Closed Consortium Interfacing,https://arxiv.org/pdf/2104.09801
"Heads in the <span class=""search-hit mathjax"">Clouds</span>: Measuring the Implications of Universities Migrating to Public <span class=""search-hit mathjax"">Clouds</span>",https://arxiv.org/pdf/2104.09462
Homomorphic Encryption-Enabled Distance-Based Distributed Formation Control with Distance Mismatch Estimators,https://arxiv.org/pdf/2104.07684
"Decentralized Federated Learning for UAV Networks: <span class=""search-hit mathjax"">Architecture</span>, Challenges, and Opportunities",https://arxiv.org/pdf/2104.07557
"Rendering Point <span class=""search-hit mathjax"">Clouds</span> with Compute Shaders and Vertex Order Optimization",https://arxiv.org/pdf/2104.07526
Enhanced LSTM-based Service Decomposition for Mobile Augmented Reality,https://arxiv.org/pdf/2104.07351
"Managing <span class=""search-hit mathjax"">Cloud</span> networking costs for data-intensive applications by provisioning dedicated network links",https://arxiv.org/pdf/2104.06913
Knowledge Distillation For Wireless Edge Learning,https://arxiv.org/pdf/2104.06374
"<span class=""search-hit mathjax"">Cloud</span> Big Data Mining and Analytics: Bringing Greenness and Acceleration in the <span class=""search-hit mathjax"">Cloud</span>",https://arxiv.org/pdf/2104.05765
"A Learnable Self-supervised Task for Unsupervised Domain Adaptation on Point <span class=""search-hit mathjax"">Clouds</span>",https://arxiv.org/pdf/2104.05164
"A Network-based Compute Reuse <span class=""search-hit mathjax"">Architecture</span> for IoT Applications",https://arxiv.org/pdf/2104.03818
Escape the Fake: Introducing Simulated Container-Escapes for Honeypots,https://arxiv.org/pdf/2104.03651
Half-Duplex Attack: An Effectual Attack Modelling in D2D Communication,https://arxiv.org/pdf/2104.03499
"FatNet: A Feature-attentive Network for 3D Point <span class=""search-hit mathjax"">Cloud</span> Processing",https://arxiv.org/pdf/2104.03427
Towards Soft Circuit Breaking in Service Meshes via Application-agnostic Caching,https://arxiv.org/pdf/2104.02463
"A Distributed Virtual Network Function Placement Approach in Satellite Edge and <span class=""search-hit mathjax"">Cloud</span> Computing",https://arxiv.org/pdf/2104.02421
"On Securing <span class=""search-hit mathjax"">Cloud</span>-hosted Cyber-physical Systems Using Trusted Execution Environments",https://arxiv.org/pdf/2104.01011
HVPR: Hybrid Voxel-Point Representation for Single-stage 3D Object Detection,https://arxiv.org/pdf/2104.00902
BRepNet: A topological message passing system for solid models,https://arxiv.org/pdf/2104.00706
Training Multi-bit Quantized and Binarized Networks with A Learnable Symmetric Quantizer,https://arxiv.org/pdf/2104.00210
"Few-Data Guided Learning Upon End-to-End Point <span class=""search-hit mathjax"">Cloud</span> Network for 3D Face Recognition",https://arxiv.org/pdf/2103.16927
Sparse Auxiliary Networks for Unified Monocular Depth Prediction and Completion,https://arxiv.org/pdf/2103.16690
Hybrid SDN Evolution: A Comprehensive Survey of the State-of-the-Art,https://arxiv.org/pdf/2103.16444
"Collaborative <span class=""search-hit mathjax"">Cloud</span> and Edge Mobile Computing in C-RAN Systems with Minimal End-to-End Latency",https://arxiv.org/pdf/2103.16188
"Fast and Accurate Normal Estimation for Point <span class=""search-hit mathjax"">Cloud</span> via Patch Stitching",https://arxiv.org/pdf/2103.16066
How Far Can We Go in Compute-less Networking: Computation Correctness and Accuracy,https://arxiv.org/pdf/2103.15924
Enabling Design Methodologies and Future Trends for Edge AI: Specialization and Co-design,https://arxiv.org/pdf/2103.15750
"ReAgent: Point <span class=""search-hit mathjax"">Cloud</span> Registration using Imitation and Reinforcement Learning",https://arxiv.org/pdf/2103.15231
"Noise Injection-based Regularization for Point <span class=""search-hit mathjax"">Cloud</span> Processing",https://arxiv.org/pdf/2103.15027
